obj_name,type,status,role_in_play,modern_location_eng,modern_location_rus,historic_location_eng,historic_location_rus,relative_location,location_exists_today,play,act,page_num,quote_eng,quote_rus,plot_notes,hist_notes,geo_notes,lat,lng,characters,time,sources,,,,,,,,,,Prozorov Home: Bobik's Room,estate,fictional,mentioned,N/A,N/A,N/A,N/A,center of story,N/A,Three Sisters,Act II,"266, 279","Natasha: ... Bobik is cold. I'm worried, it's too cold for him in his room, most likely. At least until the weather gets warmer we should put him in another room. For instance, Irina's room is just right for a baby, it's dry and sunny all day long. I'll have to tell her, meanwhile she can double up with Olga in the same room...

[later]

Irina: Is Bobik asleep?

Natasha: He's asleep. But he sleeps so restlessly. By the way, darling, I wanted to tell you, but you're never around, or I never have the time...Bobik's present nursery seems to me to be cold and damp. But your room is so right for a baby. Dearest, sweetheart, move in with Olya for a while! 

Irina: Where?

Natasha: You and Olya can be in one room for a while, and your room will go to Bobik.","Наташа. ...Бобик холодный. Я боюсь, ему холодно в его комнате, пожалуй. Надо бы хоть до теплой погоды поместить его в другой комнате. Например, у Ирины комната как раз для ребенка: и сухо, и целый день солнце. Надо ей сказать, она пока может с Ольгой в одной комнате... 

[later]

Ирина. Бобик спит?

Наташа. Спит. Но неспокойно спит. Кстати, милая, я хотела тебе сказать, да все то тебя нет, то мне некогда... Бобику в теперешней детской, мне кажется, холодно и сыро. А твоя комната такая хорошая для ребенка. Милая, родная, переберись пока к Оле!

Ирина. Куда?

Слышно, к дому подъезжает тройка с бубенчиками.

Наташа. Ты с Олей будешь в одной комнате, пока что, а твою комнату Бобику...","Natasha is worrying aloud to Andrey about their son's health; later she tells Irina to move in with Olya, so Bobik can take Irina's apparently sunnier room.",,,,,"Natasha, Andrey; Natasha, Irina.","the week proceeding Lent, Thursday, 8:00 p.m. A year and nine months since the action in act I.",,,,,,,,,,,Moscow University,educational institution,real,mentioned,Moscow State University,Московский государственный университет имени М. В. Ломоносова,Moscow State University,Московский государственный университет имени М. В. Ломоносова,many day's journey from story setting,yes,Three Sisters,Act II,"267, 276-277","Andrey: ...Me, a member of the local County Council; me, who dreams every night that I'm a professor at Moscow University, a famous scholar, the pride of Russia!

[later]

Tusenbach: Damn it, let's have a drink. Andryusha, let's drink to being old pals. And I'm going with you, Andryusha, to Moscow, to the University. 

Solyony: Which one? In Moscow there are two universities.

Andrey: In Moscow, there is one university.

Solyony: And I tell you - two.

Andrey: Make it three. The more the merrier.

Solyony: In Moscow there are two universities! In Moscow there are two universities: the old one and the new one. And if you don't enjoy listening to me, if my words annoy you, then I can stop talking. I can even go off into another room.","Андрей. ...Мне быть членом здешней земской управы, мне, которому снится каждую ночь, что я профессор московского университета, знаменитый ученый, которым гордится русская земля!

[later]

Тузенбах (целует Андрея). Черт возьми, давайте выпьем. Андрюша, давайте выпьем на ты. И я с тобой, Андрюша, в Москву, в университет.

Соленый. В какой? В Москве два университета.

Андрей. В Москве один университет.

Соленый. А я вам говорю — два.

Андрей. Пускай хоть три. Тем лучше.

Соленый. В Москве два университета!

В Москве два университета: старый и новый. А если вам неугодно слушать, если мои слова раздражают вас, то я могу не говорить. Я даже могу уйти в другую комнату...","Andrey is lamenting his professional fate to Ferapont, who has difficulty hearing him; later the group argues over solitare.",,,,,"Andrey, Ferapont; Tusenbach, Solyony, Chebutykin, Andrey, Masha, Irina","the week proceeding Lent, Thursday, 8:00 p.m. A year and nine months since the action in act I.",,,,,,,,,,,Testov's Tavern in Moscow,restaurant,real,mentioned,Hotel Moscow (The Four Seasons Hotel Moscow),гостиницы «Москва» — со стороны площади Революции,In the building of the Hotel Continental,в здании гостиницы Континенталь,many day's journey from story setting,no,Three Sisters,Act II,267,"Andrey: ...I don't drink, I've not great fondness for bar rooms, but I'd love to be sitting in Moscow at Testov's tavern right now or the Grand Moscow restaurant, my friend.","Андрей. ...Я не пью, трактиров не люблю, но с каким удовольствием я посидел бы теперь в Москве у Тестова или в Большом Московском, голубчик мой.","Andrey is lamenting his professional fate to Ferapont, who has difficulty hearing him.","""One of the most popular establishments in the city at the end of the nineteenth century was the capacious Testov tavern, done up in the rustic style of a Traktir - an old lower- and working-class eastery. The waiters, dressed in colorful folk costumes, rushed here and there bearing enormous portions of blini with smoked fish and caviar, oblong open pies with visiga, a dried sturgeon spring...mushrooms, called rasstegai, which was Testov's trademark, or a spectaculater twelve-tier kulebiaka...The clientele was mixed, including nobility who knew how to eat well, millionaire merchants who knew how to spend their millions, and animated knots of artists, poets, and actors, who knew little of food and had little money anyway. (137-138), source 9""",Building was demolished in 1972,55.45249,37.36593,"Andrey, Ferapont","the week proceeding Lent, Thursday, 8:00 p.m. A year and nine months since the action in act I.","9, 10",,,,,,,,,,The Grand Moscow Restaurant,restaurant,real,mentioned,unclear,unclear,unclear,unclear,many day's journey from story setting,,Three Sisters,Act II,267,"Andrey: ...I don't drink, I've not great fondness for bar rooms, but I'd love to be sitting in Moscow at Testov's tavern right now or the Grand Moscow restaurant, my friend.","Андрей. ...Я не пью, трактиров не люблю, но с каким удовольствием я посидел бы теперь в Москве у Тестова или в Большом Московском, голубчик мой.","Andrey is lamenting his professional fate to Ferapont, who has difficulty hearing him.",,,,,"Andrey, Ferapont","the week proceeding Lent, Thursday, 8:00 p.m. A year and nine months since the action in act I.",,,,,,,,,,,Moscow,city,real,mentioned,Moscow,Москва,Moscow,Москва,many day's journey from story setting,yes,Three Sisters,Act II,"267, 271, 273, 274, 280","Ferapont: Why, in Moscow, a contractor at the Council was saying the other day there was some shopkeepers eating pancakes; one ate forty pancakes and like to died... 

Andrey: You sit in Moscow in the bast main dining room of a restaurant, you don't know anyone and no one knows you, and at the same time you don't feel like a stranger. Whereas here you know everyone and everyone knows you, but you're a stranger, a stranger...A stranger and alone.

Ferapont: How's that? And that same contractor was saying-lying too, mebbe- as how there's a rope stretched across all Moscow.

Andrey: What for? 

Ferapont: How do I know? The contractor said so.

Andrey: Don't be silly. Where you ever in Moscow?

Ferapont: I was not...

[later]

Irina: ...Honest to God, I dream of Moscow every night, I'm getting to be a regular obsessive...

[later]

Irina: The solitaire's coming out, I see. We'll be in Moscow. 

Fedotik: No it isn't. You see, the eight was on top of the deuce of spaces. That means you won't be in Moscow.

[later]

Masha: Happy the man who doesn't notice whether it's summer or winter. I think if I were in Moscow, I wouldn't pay any attention to the weather...

Vershinin: ...And you'll stop noticing Moscow once you're living there. We have no happiness, there is none, we only long for it.

[later]

Irina: To Moscow! To Moscow! To Moscow!","Ферапонт. А в Москве, в управе давеча рассказывал подрядчик, какие-то купцы ели блины; один, который съел сорок блинов, будто помер. Не то сорок, не то пятьдесят. Не упомню.

Андрей. Сидишь в Москве, в громадной зале ресторана, никого не знаешь и тебя никто не знает, и в то же время не чувствуешь себя чужим. А здесь ты всех знаешь и тебя все знают, но чужой, чужой... Чужой и одинокий.

Ферапонт. Чего? И тот же подрядчик сказывал — может, и врет, — будто поперек всей Москвы канат протянут.

Андрей. Для чего?

Ферапонт. Не могу знать. Подрядчик говорил.

Андрей. Чепуха. (Читает книгу.) Ты был когда-нибудь в Москве?

Ферапонт (после паузы). Не был. Не привел бог.

[later]

Ирина. ...Господи боже мой, мне Москва снится каждую ночь, я совсем как помешанная.

[later]

Ирина. Выйдет пасьянс, я вижу. Будем в Москве.

Федотик. Нет, не выйдет. Видите, осьмерка легла на двойку пик. (Смеется.) Значит, вы не будете в Москве.

Маша. ...Мне кажется, если бы я была в Москве, то относилась бы равнодушно к погоде...

Вершинин. ...Так же и вы не будете замечать Москвы, когда будете жить в ней. Счастья у нас нет и не бывает, мы только желаем его.

[later]

Ирина (оставшись одна, тоскует). В Москву! В Москву! В Москву!","Andrey pines for Moscow to Ferapont, who updates him on rumors from a contractor in the city; Irina and Masha discuss Andrey's losses and moving to Moscow; Later the doctor and Fedotik and others play solitare; The scene ends with Irina alone, yearing for Moscow. ",,,55.756008,37.616409,"Andrey, Ferapont; Irina, Masha, Tusenbach, Vershinin; later Fedotik, Chebutykin, Anfisa, Solyony, Anfisa, and Natasha join; later just Irina. ","the week proceeding Lent, Thursday, 8:00 p.m. A year and nine months since the action in act I.",,,,,,,,,,,County Seat,city,fictional,setting,N/A,N/A,N/A,N/A,center of story,N/A,Three Sisters,Act II,"268, 270, 279","Mahsa: ...Maybe it isn't like this in other places, but in our town the most decent, most honorable and cultured people are the military.

[later]

Irina: ...If only he'd [Andrey] hurry up and lose everything, maybe we'd leave this town.

[later]

Olga: ...Andrey lost two hundred rubles at cards yesterday...The whole town's talking about it.","Маша. ...Может быть, в других местах и не так, но в нашем городе самые порядочные, самые благородные и воспитанные люди — это военные.

[later]

Ирина. ...Скорее бы всё проиграл, быть может, уехали бы из этого города

[later]

Ольга. ...Андрей проиграл вчера в карты двести рублей... Весь город говорит об этом...",Masha and Vershinin discuss habit and their town; Irina complains to Masha about Andrey's losses; Olga raises Andrey's losses from the previous night to Irina and Kulygin.,,,,,"Masha, Vershinin. Irina and Tusenbach join later; Irina, Kulygin, Olga, Vershinin","the week proceeding Lent, Thursday, 8:00 p.m. A year and nine months since the action in act I.",,,,,,,,,,,Saratov,city,real,mentioned,Saratov,Саратов,Saratov,Саратов,many day's journey from story setting,yes,Three Sisters,Act II,269,"Irina: Here I am, home at last. Just now a lady comes in, wires her brother in Saratov to say that her son has died, and she couldn't manage to remember the address. So she sent it without an address, simply to Saratov. Crying the whole time. And I was rude to her for no reason at all. ""I haven't got the time,"" I said...","Ирина. Вот я и дома, наконец. (Маше.) Сейчас приходит одна дама, телеграфирует своему брату в Саратов, что у ней сегодня сын умер, и никак не может вспомнить адреса. Так и послала без адреса, просто в Саратов. Плачет. И я ей нагрубила ни с того ни с сего. «Мне, говорю, некогда». Так глупо вышло.","Irina recalls events from her day's work at the telegraph office to Masha, Tusenbach, and Vershinin.",,,51.533333,46.016667,"Masha, Vershinin, Irina, Tusenbach","the week proceeding Lent, Thursday, 8:00 p.m. A year and nine months since the action in act I.",,,,,,,,,,,The Club,landmark,fictional,mentioned,N/A,N/A,N/A,N/A,close to the estate,N/A,Three Sisters,Act II,270,Irina: ...Yesterday the Doctor and Andrey were at the club and lost again. They say Andrey lost two hundred rubles.,"Ирина. ...Вчера доктор и наш Андрей были в клубе и опять проигрались. Говорят, Андрей двести рублей проиграл.",Irina complains to Masha about Andrey's losses.,,,,,"Irina, Masha, Vershinin, Tusenbach","the week proceeding Lent, Thursday, 8:00 p.m. A year and nine months since the action in act I.",,,,,,,,,,,The Military Academy,educational institution,fictional,mentioned,N/A,N/A,N/A,N/A,many day's journey from story setting,,Three Sisters,Act II,271,"Vershinin: I finished school at the same grade you did, I didn't go to the Military Academy...","Вершинин. Я кончил там же, где и вы, в академии я не был...",Two of the sisters and Vershinin and Tusenbach discuss their outlook on future generations and knowledge.,,,,,"Irina, Vershinin, Tusenbach, Masha, Chebutykin","the week proceeding Lent, Thursday, 8:00 p.m. A year and nine months since the action in act I.",,,,,,,,,,,Berdichev,city,real,mentioned,Berdychiv,Бердичев,Berdichev,Бердичев,many day's journey from story setting,yes,Three Sisters,Act II,272,"Chebutykin: Balzac was married in Berdichev. That's something to jot down in the book. Balzac was married in Beridchev.

Irina: Balzac was married in Berdichev.","Чебутыкин (читая газету). Бальзак венчался в Бердичеве. Даже запишу себе это в книжку. (Записывает.) Бальзак венчался в Бердичеве. (Читает газету.)

Ирина (раскладывает пасьянс, задумчиво). Бальзак венчался в Бердичеве.","Chebutykin seems to read this information in the paper and announces it to Irina, Masha, and Tusenbach.",,City in the Kiev gubernia in Ukraine; populated mostly by Jews.,"49.9,28.566667",28.566667,"Irina, Vershinin, Tusenbach, Masha, Chebutykin","the week proceeding Lent, Thursday, 8:00 p.m. A year and nine months since the action in act I.",,,,,,,,,,,Pyzhikov's Shop,shop,fictional,mentioned,N/A,N/A,N/A,N/A,Moscow Street; close to the estate,N/A,Three Sisters,Act II,273,Fedotik: Just now on Moscow Street at Pyzhikov's I bought you some colored pencils. And here's a little penknife.,Федотик (Ирине). Сейчас на Московской у Пыжикова купил для вас цветных карандашей. И вот этот ножичек...,"Fedotik purchased a small gift for Irina, who notes that he is treating her like a child, although she is delighted by the offering.",,,,,"Irina, Fedotik, Rode, Chebutykin, Vershinin, Masha","the week proceeding Lent, Thursday, 8:00 p.m. A year and nine months since the action in act I.",,,,,,,,,,,Tsitsikar,province,real,mentioned,Qiqihar,Цицикар,Qiqihar (Tsitihar),Цицикар,abroad,yes,Three Sisters,Act II,273,Chebutykin: Tsitsikar. Smallpox is raging there.,Чебутыкин (читает газету). Цицикар. Здесь свирепствует оспа.,Chebutykin reads the paper while the others play solitaire.,,"From the Norton: ""a province of Chinese Manchuria""",47.2023,123.5704,"Irina, Fedotik, Rode, Chebutykin, Vershinin, Masha","the week proceeding Lent, Thursday, 8:00 p.m. A year and nine months since the action in act I.",,,,,,,,,,,Caucasus,region,real,mentioned,"south Russia, Armenia, Georgia, Azerbaijan","Азербайджан. Армения, Грузия, Россия",The Russian Empire,Российская Империя,many day's journey from story setting,yes,Three Sisters,Act II,276,Chebutykin: Why should I argue with you? You were never in the Caucasus and never ate chekhartma.,Чебутыкин. Что же я буду с вами спорить! Вы никогда не были на Кавказе и не ели чехартмы.,"The group argues while playing solitare. In this particular instance, Solyony and Chebutykin dispute the dish chekhartma (correctly chikhartma). Solyony claims it is onion, while Chebutykin believes it is roasted mutton.","From the Norton: ""Chikhartma is a Caucasian soup of lamb or chicken, flaborted with coriander and saffron. (276)""",,43.5852,45,"Irina, Fedotik, Rode, Chebutykin, Vershinin, Masha, Tusenbach, Andrey","the week proceeding Lent, Thursday, 8:00 p.m. A year and nine months since the action in act I.",,,,,,,,,,,Prozorov Home: The Kitchen,estate,fictional,mentioned,N/A,N/A,N/A,N/A,center of story,N/A,Three Sisters,Act II,278,"Andrey: I won't play tonight, I'll just sit and watch. I don't feel well...Doctor, what should I do for shortness of breath?

Chebutykin: Why ask? I don't remember, my boy. I don't know.

Andrey: Let's go through the kitchen.","Андрей. Сегодня я играть не стану, только так посижу. Нездоровится... Что мне делать, Иван Романыч, от одышки?

Чебутыкин. Что спрашивать! Не помню, голубчик. Не знаю.

Андрей. Пройдем кухней.","Andrey and Chebutykin sneak off to the club through the kitchen. After significant losses, Andrey promises not to gamble tonight; he'll just watch. ",,,,,"Andrey, Chebutykin","the week proceeding Lent, Thursday, 8:00 p.m. A year and nine months since the action in act I.",,,,,,,,,,,Prozorov Home: Olga's room,estate,fictional,setting,N/A,N/A,N/A,N/A,center of story,N/A,Three Sisters,Act III,280,"""Olga's and Irina's room. Beds at left and right fenced 'round with screens.""","""Комната Ольги и Ирины. Налево и направо постели, загороженные ширмами.""",Stage is set for Act III,,,,,"Olga, Anfisa, Masha",3:00 a.m.,,,,,,,,,,,Prozorov Home,estate,fictional,mentioned,N/A,N/A,N/A,N/A,center of story,N/A,Three Sisters,Act III,"281, 282, 287","""Through the open door can be seen a window, red with the glow in the sky, and the fire brigade can be heard driving past the house.""

[later]

Natasha: ...We've got so many people all over the place, whereever you go, the house is packed.

[later]

Natasha: We've got to thrash this out, Olya, once and for all...You're at the high school, I'm at home...

[later]

Masha: ...I mean about Andrey...He's mortgaged this house to the bank and his wife snatched all the money, but in fact the house belongs not just to him but to the four of us!","""В открытую дверь видно окно, красное от зарева; слышно, как мимо дома проезжает пожарная команда.""

[later]

Наташа: У нас так много народу везде, куда ни пойдешь, полон дом. 

[later]

Наташа. Нам нужно уговориться, Оля. Раз навсегда... Ты в гимназии, я — дома, у тебя ученье, у меня — хозяйство.

[later]

Маша. ...Я про Андрея... Заложил он этот дом в банке, и все деньги забрала его жена, а ведь дом принадлежит не ему одному, а нам четверым!","Olga and Anfisa can see the fire raging through their window; Later, inspite of the onging crisis, Natasha raises the issue of Anfisa's continued presence and employment with Olga; Later Masha describes how worn out she is.",,,,,"Olga, Anfisa, Masha; Ferapont and Natasha join later; Kulygin, Masha, and Irina.",3:00 a.m.,,,,,,,,,,,Kirsanov Lane,street,fictional,mentioned,N/A,N/A,N/A,N/A,close to the estate,N/A,Three Sisters,Act III,280,"Olga:...What a thing to happen, dear God! Kirsanov Lane is burnt to the ground, it seems. The poor Vershinins are in a panic...Their house was nearly burned down...","Что же это такое, боже мой! Кирсановский переулок сгорел весь, очевидно... Это возьми... Это возьми... (Кидает ей на руки платье.) Вершинины бедные напугались... Их дом едва не сгорел.",Olga and Anfisa can see the fire raging through their window. Olga gathers clothes for the Vershinin girls to wear.,,,,,"Olga, Anfisa, Masha",3:00 a.m.,,,,,,,,,,,Vershinin Home,estate,fictional,mentioned,N/A,N/A,N/A,N/A,close to the estate,N/A,Three Sisters,Act III,"280, 285","Olga:...What a thing to happen, dear God! Kirsanov Lane is burnt to the ground, it seems. The poor Vershinins are in a panic...Their house was nearly burned down...

[later]

Vershinin: When the fire broke out, I rushed home at once; I get there, take a look - our house is intact and unharmed and out of danger, but my tow little girls are standing on the doorstep in nothing but their underwear...","Ольга. Что же это такое, боже мой! Кирсановский переулок сгорел весь, очевидно... Это возьми... Это возьми... (Кидает ей на руки платье.) Вершинины бедные напугались... Их дом едва не сгорел.

[later]

Вершинин. Когда начался пожар, я побежал скорей домой; подхожу, смотрю — дом наш цел и невредим и вне опасности, но мои две девочки стоят у порога в одном белье...
",Olga and Anfisa can see the fire raging through their window. Olga gathers clothes for the Vershinin girls to wear; later Vershinin recalls the experiences of the fire to the group.,,,,,"Olga, Anfisa, Masha; later Irina, Tusenbach, Kulygin, Chebutykin, and Vershinin sit and catch up on the night's events.",3:00 a.m.,,,,,,,,,,,