obj_name,type,status,role_in_play,modern_location_eng,modern_location_rus,historic_location_eng,historic_location_rus,relative_location,location_exists_today,play,act,page_num,quote_eng,quote_rus,plot_notes,hist_notes,geo_notes,lat,lng,characters,time,sources,,,,,,,,,,Serebryakov's Estate,estate,fictional,setting,N/A,N/A,N/A,N/A,center of story,N/A,Uncle Vanya,Act I,196,"""The action takes place on Serebryakov's estate.""","""Действие происходит в усадьбе Серебрякова.""","We later learn that this is the estate belonging to the professor's first wife, and that the professor resides here because he cannot afford to live in town (200).",,,,,full cast,,,,,,,,,,,,The Garden,garden,fictional,setting,N/A,N/A,N/A,N/A,outside of estate,N/A,Uncle Vanya,Act I,197,"""The garden. Part of the house and its veranda are visible. Along the path beneath an old poplar there is a table set for tea. Benches, chairs; a guitar lies on one of the benches. Not far from the table is a swing""","""Сад. Видна часть дома с террасой. На аллее под старым тополем стол, сервированный для чая. Скамьи, стулья; на одной из скамей лежит гитара. Недалеко от стола качели""",Stage is set for start of play. ,,,,,,"""Takes place between two and three in the afternoon""",,,,,,,,,,,Malitskoe,village,real,mentioned,Within Yaranskiy rayon,Яранский район,Malitskiy,Малицкий,within riding distance of Astrov's estate,no,Uncle Vanya,Act I,198,"Astrov: No. In Lent, third week, I went to Malitskoe to deal with an epidemic...Spotted typhus...In the huts the peasants were packed side by side...Mud, stench, smoke, bull calves on the floor right next to the sick...Piglets too...","Астров. Нет. В Великом посту на третьей неделе поехал я в Малицкое на эпидемию... Сыпной тиф... В избах народ вповалку... Грязь, вонь, дым, телята на полу, с больными вместе... Поросята тут же...","Introductory exchange beween Astrov and nanny Marina. Astrov replies ""No"" to Marina's offer of a bite to eat and then launches, unprompted, into his recollection of the peasant village.","According to ""Register of villages and inhabitants for 1891,"" the village had seven families and 39 residents, and they primarily served as laborers (поденщик). ","Chekhov used the names of villages near Melikhovo for his fictional ones. This village was located within Vyatskaya guberniya, YAranskiy uyezd, Pishtanskaya volost’, Kozhinskoye obshchestvo. (Вятская губерния, Яранский уезд, Пиштанская волость, Кожинское общество)              ",,,"Astrov, Marina",The third week of Lent,"1,2,3",,,,,,,,,,State Forest Preserve,forest,fictional,mentioned,N/A,N/A,N/A,N/A,bordering Astrov's estate,N/A,Uncle Vanya,Act I,"199, 204-205","Sonya: Tomorrow we'll go to the forest preserve, Papa. Would you like that?","Соня. Мы завтра поедем в лесничество, папа. Хочешь?
","Serebryakov, Yelena Andreevna, Sonya and Telegin have just returned to the garden from a walk.This is Sonya's first line in the play. Her father does not respond to this comment directly. A few lines later, she raises the issue again (""And you're sure to enjoy a visit to the forest preserve...""). Later, in act I, Astrov notes that his estate borders the preserve and that he often takes care of the forests (204). His praise for the forests, which he believes alleviate a harsh climate and teach people to understand beauty and inspire them with a sense of granduer, echoes that of the era's naturalist movement.",,,,,"Sonya, Serebryakov, Yelena Andreevna, Telegin, Voinitysky, Astrov, Marina",,,,,,,,,,,,Telegin's Estate,estate,fictional,mentioned,N/A,N/A,N/A,N/A,unclear,N/A,Uncle Vanya,Act I,201,"Telegin: Excuse me, Vanya. My wife ran away with the man she loved the day after our wedding on account of my unprepossessing looks. I didn't shrink my duty despite it all. I love her to this day, and I'm faithful to her, I help however, I can, and sold my estate to educate the kiddies she bore to the man she loved.","Телегин. Позволь, Ваня. Жена моя бежала от меня на другой день после свадьбы с любимым человеком по причине моей непривлекательной наружности. После того я своего долга не нарушал. Я до сих пор ее люблю и верен ей, помогаю, чем могу, и отдал свое имущество на воспитание деточек, которых она прижила с любимым человеком.",Telegin is interjecting in a conversation between Astrov and Voinitsky about Yelena Andreevna's faithfulness.,,,,,"Telegin, Voinitsky, Astrov",,,,,,,,,,,,The Factory,factory,fictional,mentioned,N/A,N/A,N/A,N/A,within riding distance of Serebryakov's estate,N/A,Uncle Vanya,Act I,203,"Workman: Is Mister Doctor here? (To Astrov.) 'Scuse me, Dr. Astrov, there's some folks here to fetch you.  

Astrov: Where from? Workman: The factory.","Работник. Господин доктор здесь? (Астрову.) Пожалуйте, Михаил Львович, за вами приехали.

Астров. Откуда?

Работник. С фабрики.","Telegin is playing a polka on the guitar, while the rest of the household sits in silence after Voinitsky remarked that the weather was good for hanging oneself. ","From the Norton: Between 1887 and 1900, the number of factory workers in Russia increased from one million to 2.5 million. Sanitary and housing conditions were very bad, since employers were not compelled to protect workers against dangerous machinery and few factories provided medical attention (203).",,,,"Workman, Astrov, Sonya, Voinitsky, Yelena Andreevna",,,,,,,,,,,,Astrov's Estate,estate,fictional,mentioned,N/A,N/A,N/A,N/A,within riding distance of the factory and Serebryakov's estate; bordering the state forest preserve,N/A,Uncle Vanya,Act I,204,"Astrov: (to Yelena Andreevna.) If you drop in on me some time, along with Sofiya Aleksandrovna of course, I'd be really delighted. I have a smallish estate, no more than eight acres in all, but if you're interested, there's an experimental orchard and a tree nursery, the likes of which you'll not find a thousand miles around. Next door I've got the state forest preserve...","Астров...Если когда-нибудь заглянете ко мне, вот вместе с Софьей Александровной, то буду искренно рад. У меня небольшое именьишко, всего десятин тридцать, но, если интересуетесь, образцовый сад и питомник, какого не найдете за тысячу верст кругом. Рядом со мною казенное лесничество... ",Astrov has just been called to tend to an ill or injured worker at a nearby factory. He is saying goodbye to the family. ,,,,,"Astrov, Yelena Andreevna, Sonya, Voinitsky",,,,,,,,,,,,The Garden,garden,fictional,mentioned,N/A,N/A,N/A,N/A,outside of estate,N/A,Uncle Vanya,Act II,"205, 208, 218","""The dining room in Serebryakov's house. - Night. - We can hear the watchman tapping in the garden.""","""Столовая в доме Серебрякова. — Ночь. — Слышно, как в саду стучит сторож.""","Stage is set for Act II. Later, the watchman is invoked again. This time, he is heard not only tapping in the garden, but also singing (208). Finally, at the end of the act, the watchman is tapping again. Yelena Andreevna asks him to stop because the professor is not well (218).",,,,,"watchman, Serebryakov, Yelena Andreevna",Night - 12:20 a.m.. to be exact.,,,,,,,,,,,Serebryakov's Estate: the Dining Room,estate,fictional,setting,N/A,N/A,N/A,N/A,center of story,N/A,Uncle Vanya,Act II,206-207,"""The dining room in Serebryakov's house. - Night. - We can hear the watchman tapping in the garden.""","""Столовая в доме Серебрякова. — Ночь. — Слышно, как в саду стучит сторож.""","Stage is set for Act II. Later, the wind picks up and Yelena Andreevna closes the windows, expecting rain (208). When others enter, imploring the professor to go to bed, Marina notes that the samovar remains on the table (209).",,,,,"watchman, Serebryakov, Yelena Andreevna",Night - 12:20 a.m.. to be exact.,,,,,,,,,,,Serebryakov's Estate: the Library,estate,fictional,mentioned,N/A,N/A,N/A,N/A,center of story,N/A,Uncle Vanya,Act II,207,"Serebryakov: In the morning, see if we've got a Batyushkov in the library. I think we have him...","Серебряков. Утром поищи в библиотеке Батюшкова. Кажется, он есть у нас.
",Serebryakov and Yelena Andreevna are dozing in the dining room. Serebryakov reminds Yelena Andreevna to check (in the morning) if there is a copy of Batyushkov's poems in the library.,"From the Norton: Konstantin Nikolaevich Batyushkov, a Russian Romantic poet, an immediate forerunner of Pushkin and author of the best Anacreontic verse in Russian. Evidently the professor wants to read about wine, women and song (207).",,,,"Serebryakov, Yelena Andreevna",Night - 12:20 a.m.. to be exact.,,,,,,,,,,,Serebryakov's Estate,estate,fictional,setting,N/A,N/A,N/A,N/A,center of story,N/A,Uncle Vanya,Act II,"209, 211, 213","Yelena Andreevna: There's something oppressive about this house. Your mother hates everything except her pamphlets and the Professor; the Professor is irritable, won't trust me, is adraid of you; Sonya's nasty to her father, nasty to me, and hasn't spoken to me for two weeks now; you hate my husband and openly despire your mother; I'm irritable and today some twenty times I was ready to burst into tears...There's something oppressive about this house.

Voinitsky [to her, later]: And if only you had any idea how I suffer at the thought that right beside me in this house another life is fading away - yours!

Voinitsky [later, alone]: Sonya and I squeezed every last drop out of this estate; like grasping peasants we drove a rade in vegetable oil, peas, cottage cheese; stined ourselves on crumbs so we could scrape togehter the pennies and small change in thousands and send them to him [the Professor].

Astrov [later, to Sonya]: You know, I have the feeling I wouldn't last a month in your house, I'd suffer in this atmosphere...Your father, all wrapped up in his gout and his books, Uncle Vanya with his biliousness, your grandmothe, lastly your stepmother.","Елена Андреевна. Неблагополучно в этом доме. Ваша мать ненавидит все, кроме своих брошюр и профессора; профессор раздражен, мне не верит, вас боится; Соня злится на отца, злится на меня и не говорит со мною вот уже две недели; вы ненавидите мужа и открыто презираете свою мать; я раздражена и сегодня раз двадцать принималась плакать... Неблагополучно в этом доме.

[later]

Войницкий (загораживая ей дорогу). И если бы вы знали, как я страдаю от мысли, что рядом со мною в этом же доме гибнет другая жизнь — ваша! 

Войницкий. ...Я и Соня выжимали из этого имения последние соки; мы, точно кулаки, торговали постным маслом, горохом, творогом, сами не доедали куска, чтобы из грошей и копеек собирать тысячи и посылать ему. 

Астров. [later] Знаете, мне кажется, что в вашем доме я не выжил бы одного месяца, задохнулся бы в этом воздухе... Ваш отец, который весь ушел в свою подагру и в книги, дядя Ваня со своею хандрой, ваша бабушка, наконец, ваша мачеха...","Serebryakov, Sonya, and Marina have just left for bed. Yelena Andreevna and Voinitysky remain. They are discussing the professor's health and how his behavior causes others to lose sleep. Yelena Andreevna's repeated comment about the house's oppressive nature starts and ends her tirade. Voinitsky discusses how he feels he is wasting his life away and raises his feelings for Yelena Andreevna. Later Astrov and Sonya are chatting. ",,,,,"Yelena Andreevna, Voinitysky; Astrov, Sonya",Night - past 12:00 p.m.,,,,,,,,,,,Moscow,city,real,mentioned,Moscow,Москва,Moscow,Москва,many day's journey from story setting,yes,Uncle Vanya,Act II,211,"Astrov: Magnificent woman. (Spots the medicine bottles on the table.) Medicine. Prescriptions galore. From Kharkov, from Moscow, from Tula...Every town in Russia must be fed up with his gout. Is he sick or faking?","Астров. Роскошная женщина. (Осматривает склянки на столе.) Лекарства. Каких только тут нет рецептов! И харьковские, и московские, и тульские... Всем городам надоел своею подагрой. Он болен или притворяется?
","Astrov, Telegin, and Voinitsky continue the late night conversation. Astrov entered, looking for the women - in particular Yelena Andreevna.",,,55.756008,37.616409,"Astrov, Telegin, Voinitsky",Night - past 12:00 p.m.,,,,,,,,,,,Kharkov,city,real,mentioned,Kharkiv ,Харьков,Kharkov,Харьков,many day's journey from story setting,yes,Uncle Vanya,Act II,211,"Astrov: Magnificent woman. (Spots the medicine bottles on the table.) Medicine. Prescriptions galore. From Kharkov, from Moscow, from Tula...Every town in Russia must be fed up with his gout. Is he sick or faking?","Астров. Роскошная женщина. (Осматривает склянки на столе.) Лекарства. Каких только тут нет рецептов! И харьковские, и московские, и тульские... Всем городам надоел своею подагрой. Он болен или притворяется?
","Astrov, Telegin, and Voinitsky continue the late night conversation. Astrov entered, looking for the women - in particular Yelena Andreevna.",,Transliterated from Ukranian into standard English spelling Kharkiv,49.988,36.23,"Astrov, Telegin, Voinitsky",Night - past 12:00 p.m.,,,,,,,,,,,Tula,city,real,mentioned,Tula,Тула,Tula,Тула,many day's journey from story setting,yes,Uncle Vanya,Act II,211,"Astrov: Magnificent woman. (Spots the medicine bottles on the table.) Medicine. Prescriptions galore. From Kharkov, from Moscow, from Tula...Every town in Russia must be fed up with his gout. Is he sick or faking?","Астров. Роскошная женщина. (Осматривает склянки на столе.) Лекарства. Каких только тут нет рецептов! И харьковские, и московские, и тульские... Всем городам надоел своею подагрой. Он болен или притворяется?
","Astrov, Telegin, and Voinitsky continue the late night conversation. Astrov entered, looking for the women - in particular Yelena Andreevna.",,,54.2,37.61,"Astrov, Telegin, Voinitsky",Night - past 12:00 p.m.,,,,,,,,,,,Astrov's Estate,estate,fictional,mentioned,N/A,N/A,N/A,N/A,within riding distance of the factory and Serebryakov's estate; bordering the state forest preserve,N/A,Uncle Vanya,Act II,"212, 213","Astrov: [to Voinitsky] A drink's what I need. Let's go back in; I think we've still got some cognac left. And when it's light, we'll head over to my place. Want to go for a rod? I've got an orderly who never says ""ride,"" always says ""rod."" Terrible crook. So want to go for a rod?

Astrov: [later, to Sonya] Fine. We won't drink anymore. (Pause.) I'll go home right now. No sooner said than done. Bu the time the horses are hitched, dawn'll be coming up.","Астров...А как рассветет, ко мне поедем. Идёть? У меня есть фельдшер, который никогда не скажет «идет», а «идёть». Мошенник страшный. Так идёть? 

 Астров. [later, to Sonya] Гроза идет мимо, только краем захватит. Поеду. И, пожалуйста, больше не приглашайте меня к вашему отцу. Я ему говорю — подагра, а он — ревматизм; я прошу лежать, он сидит. А сегодня так и вовсе не стал говорить со мною.

","Astrov, Telegin, and Voinitsky continue the late night conversation. Astrov has just remarked to the men that he needs another drink. Later Sonya enters and asks Astrove not to let Uncle Vanya drink. Astrov replies that they won't, and he will leave right away. Sonya pleads with him to wait until morning, due to the rain. ",,,,,"Astrov, Yelena Andreevna, Sonya, Voinitsky",Night - past 12:00 p.m.,,,,,,,,,,,The Church,church,fictional,mentioned,N/A,N/A,N/A,N/A,near estate,N/A,Uncle Vanya,Act II,214,"Sonya: [to herself] Last Sunday, when we were coming out of church, I heard the way they talked about me, and one woman said, ""She's kind and good-natured, what a pity she's so unattractive...""","Соня. В прошлое воскресенье, когда выходили из церкви, я слышала, как говорили про меня, и одна женщина сказала: «Она добрая, великодушная, но жаль, что она так некрасива»... Некрасива...",Astov has just left. Sonya is lamenting her apparent unattractiveness.,,,,,Sonya,Night - past 12:00 p.m.,,,,,,,,,,,The St. Petersburg Conservatory,educational institution,real,mentioned,Saint Petersburg,Санкт Петербург,Saint Petersburg,Saint Petersburg,many day's journey from story setting,yes,Uncle Vanya,Act III,221,"Astrov: Where were you born? 

Yelena Andreevna: In Petersburg. 

Astrov: And educated? 

Yelena Andreevna: At the Conservatory","Астров. О, конечно. (Растягивает на ломберном столе картограмму и укрепляет ее кнопками.) Вы где родились?

Елена Андреевна (помогая ему). В Петербурге.

Астров. А получили образование?

Елена Андреевна. В консерватории.","Astrov has come to show Yelena Andreevna his drawings, and they chat while unrolling the diagram on the card table. Yelena Andreevna has recently promised Sonya that she will inquire about Astrov's feelings toward Sonya. Yelena Andreevna, however, knows full well that Astrov is not interested in Sonya. Yelena Andreevna also noted she finds Astrov ""a wee bit attractive.""  ","From the Norton: Founded in 1862 by Anton Rubinstein, the Conservatry was an outstanding ""nursery of brilliant musicians (221); Current building was erected in the 1890s.",Find exact location of Saint Petersburg conservatory,59.926118,30.298112,"Astrove, Yelena Andreevna",Daytime - 12:40 p.m..,,,,,,,,,,,Serebryakov's Estate: The Parlor,estate,fictional,setting,N/A,N/A,N/A,N/A,center of story,N/A,Uncle Vanya,Act III,218,"""Parlor in Serebryakov's house. Three doors: right, left, and center. - Daytime. Voinitsky and Sonya are sitting; Yelena Andreevna walks about the stage with something on her mind.""","""Гостиная в доме Серебрякова. Три двери: направо, налево и посредине. — День.

Войницкий, Соня (сидят) и Елена Андреевна (ходит по сцене, о чем-то думая).""",Stage set for Act III.,,,,,"Voinitsky, Sonya, Yele Andreevna",Daytime - 12:40 p.m..,,,,,,,,,,,The Fair,fair,fictional,mentioned,N/A,N/A,N/A,N/A,within riding distance,N/A,Uncle Vanya,Act III,219,"Sonya: How about a little work? Only the lady has to make an effort.

Yelena Andreevna: For instance?

Sonya: Get involved in running the farm, teach, tend the sick. Isn't that enough? Around here, before you and Papa arrived, Uncle Vanya and I used to go to the fair ourselves to market the flour.","Соня (пожимая плечами). Мало ли дела? Только бы захотела.

Елена Андреевна. Например?

Соня. Хозяйством занимайся, учи, лечи. Мало ли? Вот когда тебя и папы здесь не было, мы с дядей Ваней сами ездили на базар мукой торговать.","Yelena Andreevna, Sonya, and Voinitsky are chatting in the parlor prior to the 1:00 p.m. meeting with the Professor.",,,,,"Voinitsky, Sonya, Yele Andreevna",Daytime - 12:40 p.m..,,,,,,,,,,,Serebryakov's Estate: Uncle Vanya's Room,estate,fictional,mentioned,N/A,N/A,N/A,N/A,center of story,N/A,Uncle Vanya,Act III,"220, 221","Yelena Andreevna: Where is the doctor?

Sonya: In Uncle Vanya's room.

Astrov: (later) Here in this house I have my own table...In Ivan Petrovich's room.","Елена Андреевна. Где доктор?

Соня. В комнате у дяди Вани. 

[later]

Астров. Здесь в доме есть мой собственный стол... В комнате у Ивана Петровича. ","Yelena Andreevna, Sonya, and Voinitsky are chatting in the parlor prior to the 1:00 p.m. meeting with the Professor. Later Yelena and Andreevna and Astrov are chatting alone.",,,,,"Voinitsky, Sonya, Yelena Andreevna; Astrov and Yelena Andreevna. ",Daytime - 12:40 p.m..,,,,,,,,,,,