obj_name,type,status,role_in_play,modern_location_eng,modern_location_rus,historic_location_eng,historic_location_rus,relative_location,location_exists_today,play,act,page_num,quote_eng,quote_rus,plot_notes,hist_notes,geo_notes,lat,lng,characters,time,sources,,,,,,,,,,Moscow,city,real,mentioned,Moscow,Москва,Moscow,Москва,many day's journey from story setting,yes,The Cherry Orchard,Act I,"329, 332","Varya: ...If only there were a rich man for you to marry, even I would be at peace, I'd go to a hermitage, then to Kiev...to Moscow, and I'd keep on going like that to holy shrines...I'd go on and on. Heaven!

[later]

Firs: And used to be whole cartloads of dried cherries were sent to Moscow and Kharkov.","Варя. ...Выдать бы тебя за богатого человека, и я бы тогда была покойней, пошла бы себе в пустынь, потом в Киев... в Москву, и так бы все ходила по святым местам... Ходила бы и ходила. Благолепие!..

[later]

Фирс. И, бывало, сушеную вишню возами отправляли в Москву и в Харьков.",Varya describes her desire to become a pilgrim to Anya; Firs recalls how profitable the cherries were in times past.,,,55.756008,37.616409,"Anya, Varya","May, 2:00 a.m.",,,,,,,,,,,Kiev,city,real,mentioned,Kiev,Киев,Kiev,Киев,many day's journey from story setting,yes,The Cherry Orchard,Act I,329,"Varya: ...If only there were a rich man for you to marry, even I would be at peace, I'd go to a hermitage, then to Kiev...to Moscow, and I'd keep on going like that to holy shrines...I'd go on and on. Heaven!","Варя. ...Выдать бы тебя за богатого человека, и я бы тогда была покойней, пошла бы себе в пустынь, потом в Киев... в Москву, и так бы все ходила по святым местам... Ходила бы и ходила. Благолепие!..",Varya describes her desire to become a pilgrim to Anya.,,,50.4501,30.5234,"Anya, Varya","May, 2:00 a.m.",,,,,,,,,,,The River,body of water,fictional,mentioned,N/A,N/A,N/A,N/A,close to the estate,N/A,The Cherry Orchard,Act I,329,"Anya: Six years ago father died; a month later, our brother Grisha drowned in the river, a sweet little, boy seven years old. Mama couldn't stand it, she went away...","Аня (задумчиво.) Шесть лет тому назад умер отец, через месяц утонул в реке брат Гриша, хорошенький семилетний мальчик. Мама не перенесла, ушла, ушла без оглядки...",Anya recalls her brother's death and mother's depression.,,,,,"Anya, Varya","May, 2:00 a.m.",,,,,,,,,,,Kharkov,city,real,mentioned,Kharkiv ,Харьков,Kharkov,Харьков,many day's journey from story setting,yes,The Cherry Orchard,Act I,"331, 332","Lopakhin: I've got to leave for Kharkov right away, around five.

[later]

Firs: And used to be whole cartloads of dried cherries were sent to Moscow and Kharkov.","Лопахин. Мне сейчас, в пятом часу утра, в Харьков ехать.

[later]

Фирс. И, бывало, сушеную вишню возами отправляли в Москву и в Харьков.",Lopakhin leaves for Kharkov; Firs recalls how profitable the cherries were in times past.,,,49.988,36.23,"Lopakhin, Gaev, Firs, Lyubov Andreevna, Varya, Pishchik","May, 2:00 a.m.",,,,,,,,,,,Town,town,fictional,mentioned,N/A,N/A,N/A,N/A,13 miles from the estate,N/A,The Cherry Orchard,Act I,"331, 332","Gaev: And Anastasy died. Cross-eyed Petrusha left me and now he's working in town for the chief of police.

[later]

Lopakhin: ...As you already know, the cherry orchard will be sold to pay your debts, the auction is set for August twenty-second, but don't you worry, dear lady, don't lose any sleep, there's a way out...Here's my plan. Your attention please! Your estate lies only thirteen miles from town, the railroad runs past it, and if the cherry orchard and the land along the river were subdivided into building lots and then leased out for summer cottages, you'd have an income of at the very least twenty-five thousand a year.","Гаев. И Анастасий умер. Петрушка Косой от меня ушел и теперь в городе у пристава живет. 

[later]

Лопахин. ...Вам уже известно, вишневый сад ваш продается за долги, на двадцать второе августа назначены торги, но вы не беспокойтесь, моя дорогая, спите себе спокойно, выход есть... Вот мой проект. Прошу внимания! Ваше имение находится только в двадцати верстах от города, возле прошла железная дорога, и если вишневый сад и землю по реке разбить на дачные участки и отдавать потом в аренду под дачи, то вы будете иметь самое малое двадцать пять тысяч в год дохода.",Gaev catches Lyubov Andreevna up on news from the town; Lopakhin proposes his plan to save the estate at the expense of the orchard.,,,,,"Lopakhin, Gaev, Firs, Lyubov Andreevna, Varya, Pishchik","May, 2:00 a.m.",,,,,,,,,,,Yaroslavl,city,real,mentioned,Yaroslavl,Ярославль,Yaroslavl,Ярославль,many day's journey from story setting,yes,The Cherry Orchard,Act I,"337, 338, 339","Gaev: ...It would be nice to inherit a fortune from somebody, nice if we married our Anya to a very rich man, nice to go to Yaroslavl and try out luck with out Auntie the Countess. Auntie's really very, very wealthy.

[later]

Gaev: ...And you, after you've had a rest, will go to Yaroslavl to the Countess, your great aunt.

[later]

Anya: Now I'm clam. I don't want to go to Yaroslavl. I don't like my great aunt, but all the same, I'm calm. Thanks to Uncle.","Гаев. ...Хорошо бы получить от кого-нибудь наследство, хорошо бы выдать нашу Аню за очень богатого человека, хорошо бы поехать в Ярославль и попытать счастья у тетушки-графини. Тетка ведь очень, очень богата.

[later]

Гаев. ...А ты, как отдохнешь, поедешь в Ярославль к графине, твоей бабушке...

[later]

Аня. Я теперь покойна. В Ярославль ехать не хочется, я не люблю бабушку, но все же я покойна. Спасибо дяде.","Gaev proposes seeking financial assistance from their great aunt, a countess in Yaroslavl.",,,57.616667,39.85,"Gaev, Varya, Anya","May, 2:00 a.m.",,,,,,,,,,,The County Courthouse,municipal building,fictional,mentioned,N/A,N/A,N/A,N/A,close to the estate,N/A,The Cherry Orchard,Act I,338,"Gaev: ...Thursday I was at the county courthouse, well, some friends gathered 'round, started talking about this and that, six of one, half a dozen of the other, and it turns out a person can sign a promissory note and borrow money to pay the interest to the bank.","Гаев. ...В четверг я был в окружном суде, ну, сошлась компания, начался разговор о том, о сем, пятое-десятое, и, кажется, вот можно будет устроить заем под векселя, чтобы заплатить проценты в банк.","Gaev relays his ideas for saving the estate, one of which involves promissory notes and borrowing.",,,,,"Gaev, Anya, Varya","May, 2:00 a.m.",,,,,,,,,,,Field,field,fictional,setting,N/A,N/A,N/A,N/A,close to the estate,N/A,The Cherry Orchard,Act II,340,"""A field...A road into Gaev's estate can be seen...and way in the distance, dimly sketched on the horizon, is a larhe town, which can be seen only in the best and clearest weather.""","""Поле...Видна дорога в усадьбу Гаева...далеко-далеко на горизонте неясно обозначается большой город, который бывает виден только в очень хорошую, ясную погоду.""",The stage is set for Act II,,,,,"Charlotta, Yasha, Dunyasha, Yepikhodov",,,,,,,,,,,,Gaev's Estate,estate,fictional,mentioned,N/A,N/A,N/A,N/A,close to the estate,N/A,The Cherry Orchard,Act II,340,"""A field...A road into Gaev's estate can be seen...and way in the distance, dimly sketched on the horizon, is a larhe town, which can be seen only in the best and clearest weather.""","""Поле...Видна дорога в усадьбу Гаева...далеко-далеко на горизонте неясно обозначается большой город, который бывает виден только в очень хорошую, ясную погоду.""",The stage is set for Act II,,,,,"Charlotta, Yasha, Dunyasha, Yepikhodov",,,,,,,,,,,,Town,town,fictional,mentioned,N/A,N/A,N/A,N/A,13 miles from the estate,N/A,The Cherry Orchard,Act II,"340, 343","""A field...A road into Gaev's estate can be seen...and way in the distance, dimly sketched on the horizon, is a larhe town, which can be seen only in the best and clearest weather.""

[later]

Lopakhin: Deriganov the rich man intends to purchase your estate. They say he's coming to the auction in person.

Lyubov Andreevna: Where did you hear that?

Lopakhin: They were talking about it in town.","""Поле...Видна дорога в усадьбу Гаева...далеко-далеко на горизонте неясно обозначается большой город, который бывает виден только в очень хорошую, ясную погоду.""

[later]

Лопахин. Ваше имение собирается купить богач Дериганов. На торги, говорят, приедет сам лично.

Любовь Андреевна. А вы откуда слышали?

Лопахин. В городе говорят.","The stage is set for Act II; Lyubov Andreevna, Lopakhin, and Gaev discuss the estate sale and spending.",,,,,"Charlotta, Yasha, Dunyasha, Yepikhodov; Yasha, Lyubov Andreevna, Gaev, Lopakhin",,,,,,,,,,,,Fairground,fairground,fictional,mentioned,N/A,N/A,N/A,N/A,many day's journey from story setting,N/A,The Cherry Orchard,Act II,340,"Charlotta: ...When I was a little girl, my father and mama used to go from fairground to fairground, giving performances, pretty good ones.","Шарлотта. ...Когда я была маленькой девочкой, то мой отец и мамаша ездили по ярмаркам и давали представления, очень хорошие.","Charlotta reflects on her past and how, after her parents passed, a German gentlewoman took her in and taught her.",,,,,"Charlotta, Yasha, Dunyasha, Yepikhodov",,,,,,,,,,,,Abroad,continent,real,mentioned,Europe,Европа,Europe,Европа,abroad,yes,The Cherry Orchard,Act II,"340, 344","Dunyasha (to Yasha): Anyway, how how lucky to spend time abroad.

[later]

Lyubov Andreevna: ...I fell in love with another man, had an affair, and just at that time- this was my first punishment, dropped right on my head - over there in the river...my little boy drowned, and I went abroad, went for good, never to return, never to see that river again...","Дуняша (Яше). Все-таки какое счастье побывать за границей.

[later]

Любовь Андреевна. ...я полюбила другого, сошлась, и как раз в это время, — это было первое наказание, удар прямо в голову, — вот тут на реке... утонул мой мальчик, и я уехала за границу, совсем уехала, чтобы никогда не возвращаться, не видеть этой реки...","Dunyasha chats with Yasha in the field; Lyubov Andreevna brings up her past and her ""sins"" in conversation with Gaev and Lopakhin.",,,,,"Charlotta, Yasha, Dunyasha, Yepikhodov; Yasha, Lyubov Andreevna, Gaev, Lopakhin",,,,,,,,,,,,Ranevskaya Estate: The Kitchen,estate,fictional,mentioned,N/A,N/A,N/A,N/A,center of story,N/A,The Cherry Orchard,Act II,342,"Lyubov Andreevna: Yesterday I had lots of money, but today there's very little left. My poor Varya feed everybody milk soup to economize, in the kitchen the old people get nothing but beans, and somehow I'm spending recklessly...","Любовь Андреевна. Вчера было много денег, а сегодня совсем мало. Бедная моя Варя из экономии кормит всех молочным супом, на кухне старикам дают один горох, а я трачу как-то бессмысленно...","Lyubov Andreevna, Lopakhin, and Gaev discuss the estate sale and spending.",,,,,"Yasha, Lyubov Andreevna, Gaev, Lopakhin",,,,,,,,,,,,Restaurant,restaurant,fictional,mentioned,N/A,N/A,N/A,N/A,close to the estate,N/A,The Cherry Orchard,Act II,343,"Lyubov Andreevna: ...And why did I go out to lunch?...That nasty restaurant of yours with its music, the tablecloths smelled of soap...Why drink so much, Lyonya? Why eat so much? Why talk so much? Today in the restaurant you started talking a lot again and all beside the point. ","Любовь Андреевна. ...И зачем я поехала завтракать... Дрянной ваш ресторан с музыкой, скатерти пахнут мылом... Зачем так много пить, Леня? Зачем так много есть? Зачем так много говорить? Сегодня в ресторане ты говорил опять много и все некстати.","Lyubov Andreevna, Lopakhin, and Gaev discuss the estate sale and spending.",,,,,"Yasha, Lyubov Andreevna, Gaev, Lopakhin",,,,,,,,,,,,Ranevskaya Estate,estate,fictional,setting,N/A,N/A,N/A,N/A,center of story,N/A,The Cherry Orchard,Act II,"343, 349, 350","Lopakhin: Deriganov the rich man intends to purchase your estate. They say he's coming to the auction in person.

Lyubov Andreevna: Where did you hear that?

Lopakhin: They were talking about it in town.

[later]

Lopakhin: ...Somebody tells you in plain words your estate is about to be sold, and you act as if you don't understand.

[later]

Lopakhin: I remind you, ladies and gentlemen, on the twenty-second of August the estate will be auctioned off. Think about that!...Think!...

[later]

Anya: The house we live in hasn't been our house for a long time, and I'll go away, I give you my word.","Лопахин. Ваше имение собирается купить богач Дериганов. На торги, говорят, приедет сам лично.

Любовь Андреевна. А вы откуда слышали?

Лопахин. В городе говорят.

[later]

Лопахин. Вам говорят русским языком, имение ваше продается, а вы точно не понимаете.

[later]

Лопахин. Напоминаю вам, господа: двадцать второго августа будет продаваться вишневый сад. Думайте об этом!.. Думайте!..

[later]

Аня. Дом, в котором мы живем, давно уже не наш дом, и я уйду, даю вам слово.","Lyubov Andreevna, Lopakhin, and Gaev discuss the estate sale and spending; Left alone, Anya asks Trofimov why she longer feels the same way about the cherry orchard.",,,,,"Yasha, Lyubov Andreevna, Gaev, Lopakhin; later joined by Firs, Trofimov, Anya, and Varya",,,,,,,,,,,,Yaroslavl,city,real,mentioned,Yaroslavl,Ярославль,Yaroslavl,Ярославль,many day's journey from story setting,yes,The Cherry Orchard,Act II,343,"Gaev: Our Auntie in Yaroslavl promise to send something, but when or how much she'll send, we don't know...","Гаев. Ярославская тетушка обещала прислать, а когда и сколько пришлет, неизвестно...","Lyubov Andreevna, Lopakhin, and Gaev discuss the estate sale and spending.",,,57.616667,39.85,"Yasha, Lyubov Andreevna, Gaev, Lopakhin",,,,,,,,,,,,Ranevskaya Estate: The Cherry Orchard,orchard,fictional,setting,N/A,N/A,N/A,N/A,center of story,N/A,The Cherry Orchard,Act II,"343, 350","Lopakhin: ...Both the cherry orchard and the land have got to be leased as lots for cottages, do it right now, immediately - the auction is staring you in the face!

[later]

Anya: What have you done to me, Petya, why have I stopped loving the cherry orchard as I used to? I loved it so tenderly, there seemed to me no finer place on earth than our orchard.

Trofimov: All Russia is our orchard. The world is wide and beautiful and there are many wonderful places in it. Just think, Anya: your grandfather, great-grandfather, and all your ancestors were slave-owners; they owned living souls, and from every cherry in the orchard, every left, every tree trunk there must be human being watching you, you must hear voices...","Лопахин. ...И вишневый сад, и землю необходимо отдать в аренду под дачи, сделать это теперь же, поскорее — аукцион на носу! 

[later]

Аня. Что вы со мной сделали, Петя, отчего я уже не люблю вишневого сада, как прежде. Я любила его так нежно, мне казалось, на земле нет лучше места, как наш сад.

Трофимов. Вся Россия наш сад. Земля велика и прекрасна, есть на ней много чудесных мест. Подумайте, Аня: ваш дед, прадед и все ваши предки были крепостники, владевшие живыми душами, и неужели с каждой вишни в саду, с каждого листка, с каждого ствола не глядят на вас человеческие существа, неужели вы не слышите голосов... ","Lyubov Andreevna, Lopakhin, and Gaev discuss the estate sale and spending; Left alone, Anya asks Trofimov why she longer feels the same way about the cherry orchard.",,,,,"Yasha, Lyubov Andreevna, Gaev, Lopakhin; Later just Anya and Trofimov",,,,,,,,,,,,The River,body of water,fictional,mentioned,N/A,N/A,N/A,N/A,close to the estate,N/A,The Cherry Orchard,Act II,"344, 351","Lyubov Andreevna: ...I fell in love with another man, had an affair, and just at that time- this was my first punishment, dropped right on my head - over there in the river...my little boy drowned, and I went abroad, went for good, never to return, never to see that river again...

[later]

Anya: So what? Let's go down to the river. It's nice there.

Trofimov: Let's go.","Любовь Андреевна. ...я полюбила другого, сошлась, и как раз в это время, — это было первое наказание, удар прямо в голову, — вот тут на реке... утонул мой мальчик, и я уехала за границу, совсем уехала, чтобы никогда не возвращаться, не видеть этой реки...

[later]

Аня. Что ж? Пойдемте к реке. Там хорошо.

Трофимов. Пойдемте.","Lyubov Andreevna brings up her past and her ""sins"" in conversation with Gaev and Lopakhin; Fearing Varya's approach, Anya and Trofimov decide to move to the river.",,,,,"Yasha, Lyubov Andreevna, Gaev, Lopakhin; Anya, Trofimov",,,,,,,,,,,,Mentone,region,real,mentioned,Menton,Ментона,Mentone,Ментона,abroad,yes,The Cherry Orchard,Act II,344,"Lyubov Andreevna: ...I bought a villa near Mentone, because he fell ill there, and for three years I didn't know what it was to rest day or night: the invalid wore me out, my heart shriveled up. But last year, when the villa was sold to pay my debts, I went to Paris, and there he robbed me, ran off, hand an affair with another woman, I tried to poison myself...so silly, so shameful...and suddenly I was drawn back to Russia to my country, to my little girl...","Любовь Андреевна. ...Купила я дачу возле Ментоны, так как он заболел там, и три года я не знала отдыха ни днем, ни ночью; больной измучил меня, душа моя высохла. А в прошлом году, когда дачу продали за долги, я уехала в Париж, и там он обобрал меня, бросил, сошелся с другой, я пробовала отравиться... Так глупо, так стыдно... И потянуло вдруг в Россию, на родину, к девочке моей...","Lyubov Andreevna brings up her past and her ""sins"" in conversation with Gaev and Lopakhin.",,,43.775,7.5,"Yasha, Lyubov Andreevna, Gaev, Lopakhin",,,,,,,,,,,,Paris,city,real,mentioned,Paris,Парис,Paris,Парис,abroad,yes,The Cherry Orchard,Act II,344,"Lyubov Andreevna: ...I bought a villa near Mentone, because he fell ill there, and for three years I didn't know what it was to rest day or night: the invalid wore me out, my heart shriveled up. But last year, when the villa was sold to pay my debts, I went to Paris, and there he robbed me, ran off, hand an affair with another woman, I tried to poison myself...so silly, so shameful...and suddenly I was drawn back to Russia to my country, to my little girl...

[later]

Lyubov Andreevna: I received this today from Paris...He begs my forgiveness, implores me to come back...","Любовь Андреевна. ...Купила я дачу возле Ментоны, так как он заболел там, и три года я не знала отдыха ни днем, ни ночью; больной измучил меня, душа моя высохла. А в прошлом году, когда дачу продали за долги, я уехала в Париж, и там он обобрал меня, бросил, сошелся с другой, я пробовала отравиться... Так глупо, так стыдно... И потянуло вдруг в Россию, на родину, к девочке моей...

[later]

Любовь Андреевна. ...Получила сегодня из Парижа... Просит прощения, умоляет вернуться... ","Lyubov Andreevna brings up her past and her ""sins"" in conversation with Gaev and Lopakhin.",,,48.8584,2.2945,"Yasha, Lyubov Andreevna, Gaev, Lopakhin",,,,,,,,,,,,