obj_name,type,status,role_in_play,modern_location_eng,modern_location_rus,historic_location_eng,historic_location_rus,relative_location,location_exists_today,play,act,page_num,quote_eng,quote_rus,plot_notes,hist_notes,geo_notes,lat,lng,characters,time,sources,,,,,,,,,,The Station,municipal building,fictional,mentioned,N/A,N/A,N/A,N/A,close to the estate,unclear,The Seagull,Act II,154,"Shamraev: Dear lady! You don't know what is means to run a farm!

Arkadina: Here we go again! In that case, I shall leave for Moscow this very day. Have them hire horses for me in town, or else I'll go to the station on foot!","Шамраев. Многоуважаемая! Вы не знаете, что значит хозяйство!

Аркадина (вспылив). Это старая история! В таком случае я сегодня же уезжаю в Москву. Прикажите нанять для меня лошадей в деревне, а то я уйду на станцию пешком!",Shamraev insists that Arkadina cannot go into town; all the horses are engaged in farm work (hauling rye). Arkadina responds by threatening to leave for Moscow.,,,,,"Dorn, Arkadina, Nina, Sorin; later Dorn, Arkadina, Nina, Sorin, Shamraev, and Polina Andreevna ",Midday.,,,,,,,,,,,Zarachnaya Estate,estate,fictional,mentioned,N/A,N/A,N/A,N/A,across the river from Sorin's estate,N/A,The Seagull,Act II,159-160,"Trigorin: They're calling me...I suppose it's about packing. But I don't feel like leaving. Just look at this, God's country!..It's lovely! 

Nina: You see the house and garden across the lake?

Trigorin: Yes.

Nina: That's my late mother's country house. I was born there. I've spent my whole life on the shores of this lake and I know every islet in it. 

Trigorin: Must be nice over at your place.","Тригорин. Меня зовут... Должно быть, укладываться. А не хочется уезжать. (Оглядывается на озеро.) Ишь ведь какая благодать!.. Хорошо!

Нина. Видите на том берегу дом и сад?

Тригорин. Да.

Нина. Это усадьба моей покойной матери. Я там родилась. Я всю жизнь провела около этого озера и знаю на нем каждый островок.

Тригорин. Хорошо у вас тут!",Nina and Trigorin chat outside while the others help Arkadina pack inside. ,,,,,"Nina, Tirgorin",Midday.,,,,,,,,,,,Sorin's Estate: The Dining Room,estate,fictional,setting,N/A,N/A,N/A,N/A,center of story,N/A,The Seagull,Act III,160,"""The dining room in Sorin's house. Doors right and left. Sideboard. Cupboard with first-aid kit and medicine. Table center. Trunks and cardboard boxes; signs of preparation for a departure. Trigorin is eating lunch; Masha stands by the table.""","""Столовая в доме Сорина. Направо и налево двери. Буфет. Шкап с лекарствами. Посреди комнаты стол. Чемодан и картонки; заметны приготовления к отъезду. Тригорин завтракает, Маша стоит у стола.""
",The stage is set for Act III.,,,,,"Masha, Trigorin",,,,,,,,,,,,Sorin's Estate: Sorin's Study,estate,fictional,mentioned,N/A,N/A,N/A,N/A,center of story,N/A,The Seagull,Act III,162,"Trigorin: Page 121, lines eleven and twelve. What is there in those lines? (To Arkadina.) Are there copies of my books anywhere in the house? 

Arkadina: In my brother's study, the corner bookcase.","Тригорин (про себя). Страница 121, строки 11 и 12. Что же в этих строках? (Аркадиной.) Тут в доме есть мои книжки?

Аркадина. У брата в кабинете, в угловом шкапу.","Trigorin and Arkadina are departing shortly. Nina has gifted Trigorin a medallion with an inscription ""Days and Nights, page 121, lines eleven and twelve"", prompting Trigorin to search for a copy of his book to reference those lines.",,,,,"Trigorin, Nina, Arkadina, Yakov",,,,,,,,,,,,The Town,town,fictional,mentioned,N/A,N/A,N/A,N/A,close to the estate,N/A,The Seagull,Act III,"162, 164","Sorin: You're leaving; with you gone it'll be boring at home...

Arkadina: And what's there to do in town?

Sorin: Nothing special but even so. They'll be laying the cornerstone for the town hall and all the rest...Just for a couple of hours I'd like to stop feeling like a stick-in-the-mud; I've been getting stale, like an old cigarette holder.

[later]

Treplyov: (To his uncle.) You ought to lie down for a while, Uncle.

Sorin: For a little while, yes...But all the same I'm driving to town...I'll go lie down and drive to town...Take it from me...

[later]

Treplyov: [To Arkadina] Living in the country is bad for his health. He gets depressed. Now, Mama, if only you had a sudden fit of generosity and lent him a couple of thousand or so, he might be able to live in town all year long.

Arkadina: I have no money. I'm an actress, not a banker.","Сорин. Вы уезжаете, без вас мне будет тяжело дома.

Аркадина. А в городе что же?

Сорин. Особенного ничего, но все же. (Смеется.) Будет закладка земского дома и все такое... Хочется хоть на час-другой воспрянуть от этой пискариной жизни, а то очень уж я залежался, точно старый мундштук. 

[later]

Треплев. (Дяде.) Тебе, дядя, надо полежать.

Сорин. Немножко, да... А все-таки в город я поеду... Полежу и поеду... понятная вещь... (Идет, опираясь на трость.)

[later]

Треплев. Ему нездорово жить в деревне. Тоскует. Вот если бы ты, мама, вдруг расщедрилась и дала ему взаймы тысячи полторы-две, то он мог бы прожить в городе целый год.

Аркадина. У меня нет денег. Я актриса, а не банкирша.","Arkadina is trying to dissaude Sorin from riding with her and Trigorin into town; Sorin later nearly faints, but continues to insisnt he will ride into town; Treplyov remarks that living in the country is undermining Sorin's health and suggests that his mother to give Sorin some money to live in town. Arkadina rejects this.",,,,,"Sorin, Arkadina; Sorin, Arkadina, Treplyov; Arkadina, Treplyov.",,,,,,,,,,,,The Town Hall,municipal building,fictional,mentioned,N/A,N/A,N/A,N/A,close to the estate,N/A,The Seagull,Act III,162,"Sorin: You're leaving; with you gone it'll be boring at home...

Arkadina: And what's there to do in town?

Sorin: Nothing special but even so. They'll be laying the cornerstone for the town hall and all the rest...Just for a couple of hours I'd like to stop feeling like a stick-in-the-mud; I've been getting stale, like an old cigarette holder.","Сорин. Вы уезжаете, без вас мне будет тяжело дома.

Аркадина. А в городе что же?

Сорин. Особенного ничего, но все же. (Смеется.) Будет закладка земского дома и все такое... Хочется хоть на час-другой воспрянуть от этой пискариной жизни, а то очень уж я залежался, точно старый мундштук. ",Arkadina is trying to dissaude Sorin from riding with her and Trigorin into town.,,,,,"Sorin, Arkadina",,,,,,,,,,,,Abroad,continent,real,mentioned,Europe,Европа,Europe,Европа,abroad,yes,The Seagull,Act III,163,"Sorin: [To Arkadina] I think it would be best if you...gave him some money. First of all, he ought to be dressed like a human being and all the rest. Just look, he's been wearing the same beat-up old frockcoat for the last three years; he has to go out without a topcoat...Besides it wouldn't hurt the boy to live it up a bit...Go abroad or something...It's not all that expensive.

Arkadina: Even so...Possibly I could manage the suit, but as for going abroad...No, at the moment I can't manage the suit either. I have no money! None!","Сорин (насвистывает, потом нерешительно). Мне кажется, было бы самое лучшее, если бы ты... дала ему немного денег. Прежде всего ему нужно одеться по-человечески и все. Посмотри, один и тот же сюртучишко он таскает три года, ходит без пальто... (Смеется.) Да и погулять малому не мешало бы... Поехать за границу, что ли... Это ведь не дорого стоит.

Аркадина. Все-таки... Пожалуй, на костюм я еще могу, но чтоб за границу... Нет, в настоящее время и на костюм не могу. (Решительно.) Нет у меня денег!","Prior to her departure, Arkadina consults with Sorin on Treplyov's state. ",,,,,"Sorin, Arkadina",,,,,,,,,,,,Sorin's Estate: The Kitchen,estate,fictional,mentioned,N/A,N/A,N/A,N/A,center of story,N/A,The Seagull,Act III,164,Arkadina: ...Looks like a turban. Yesterday some tramp asked in the kitchen what your nationality was.,"Аркадина. Ты как в чалме. Вчера один приезжий спрашивал на кухне, какой ты национальности. 
",Treplyov asks his mother to change his bandage. She remarks on its appearance.,,,,,"Treplyov, Arkadina",,,,,,,,,,,,The National Theater,municipal building,real,mentioned,"Moscow, Petersburg","Москва, Петербург","Moscow, Petersburg","Москва, Петербург",many day's journey from story setting,"under different names (Российский государственный академический театр драмы им. А.С. Пушкина, and figure out what it turned into in Moscow)",The Seagull,Act III,164,"Treplyov: ...I remember long, long ago, when you were still working at the National Theater - I was a little boy then - there was a fight in our yard, a washerwoman who lived there got badly beaten up...","Треплев. ...Помню, очень давно, когда ты еще служила на казенной сцене, — я тогда был маленьким, — у нас во дворе была драка, сильно побили жилицу-прачку. Помнишь? Ее подняли без чувств... ",Treplyov asks his mother to change his bandage. ,,,,,"Treplyov, Arkadina",,,,,,,,,,,,Sorin's Estate: The Garden,estate,fictional,mentioned,N/A,N/A,N/A,N/A,center of story,N/A,The Seagull,Act III,165,"Treplyov: ...You and I are at one another's throats because of him, while he's somewhere in the drawing room or the garden, laughing at us...cultivating Nina, trying to persuade her once and for all that he's a genius.","Треплев. ...Вот мы с тобою почти ссоримся из-за него, а он теперь где-нибудь в гостиной или в саду смеется надо мной и над тобой, развивает Нину, старается окончательно убедить ее, что он гений.","Prior to Arkadina's departure, Treplyov raises the issue of Trigorin to his mother.",,,,,"Treplyov, Arkadina",,,,,,,,,,,,Sorin's Estate: The Drawing Room,estate,fictional,mentioned,N/A,N/A,N/A,N/A,center of story,N/A,The Seagull,Act III,165,"Treplyov: ...You and I are at one another's throats because of him, while he's somewhere in the drawing room or the garden, laughing at us...cultivating Nina, trying to persuade her once and for all that he's a genius.","Треплев. ...Вот мы с тобою почти ссоримся из-за него, а он теперь где-нибудь в гостиной или в саду смеется надо мной и над тобой, развивает Нину, старается окончательно убедить ее, что он гений.","Prior to Arkadina's departure, Treplyov raises the issue of Trigorin to his mother.",,,,,"Treplyov, Arkadina",,,,,,,,,,,,Kiev,city,real,mentioned,Kiev,Киев,Kiev,Киев,many day's journey from story setting,yes,The Seagull,Act III,165,Arkadina: I have never acted in that kind of play. Leave me out of it! You haven't got what it takes to write a miserable vaudeville sketch. You bourgeois from Kiev! You panhandler!,"Аркадина. Никогда я не играла в таких пьесах. Оставь меня! Ты и жалкого водевиля написать не в состоянии. Киевский мещанин! Приживал!
",Arkadina and Treplyov spar over Trigorin's writing. Treplyov and Arkadina insult each other's talent and crafts.,,,50.4501,30.5234,"Treplyov, Arkadina",,,,,,,,,,,,Russia,country,real,mentioned,Russia,Россия,The Russian Empire,Российская Империя,story takes place in Russia,yes,The Seagull,Act III,167,"Arkadina: [to Trigorin] ...You're all mine. You're so talented, clever, our greatest living writer, you're Russia's only hope...","Аркадина. ...Ты весь мой. Ты такой талантливый, умный, лучший из всех теперешних писателей, ты единственная надежда России... ",Arkadina begs Trigorin not to leave her after he admits he is attracted to Nina.,,,,,"Arkadina, Trigorin",,,,,,,,,,,,The Station,municipal building,fictional,mentioned,N/A,N/A,N/A,N/A,close to the estate,unclear,The Seagull,Act III,"168, 169","Shamraev: I have the melancholy honor of announcing that the horses are here. The time has come, dear lady, to go to the station; the train pulls in at two-o-five.

[later]

Medvedenko: And I'll go to the station on foot...to see you off. I'm a fast walker...","Шамраев (входит). Имею честь с прискорбием заявить, что лошади поданы. Пора уже, многоуважаемая, ехать на станцию; поезд приходит в два и пять минут. 

[later]

Медведенко. А я пойду пешком на станцию... провожать. Я живо... (Уходит.)

",Shamraev enters to announce that the horses have arrived and it is time for Arkadina to depart; Medvedenko plans to walk to the station to see Arkadina off.,,,,,"Arkadina, Trigorin, Shamraev; Arkadina, Sorin, Polina Andreevna, Medvedenko",,,,,,,,,,,,Elizavetgrad,city,real,mentioned,Kropyvnytskyi,Кропивницкий,"Yelisavetgrad (Elisavetgrad, Elizabethgrad)",Елисаветград,many day's journey from story setting,yes,The Seagull,Act III,168,"Shamraev: ...By the way, Irina Nikolaevna, do me a favor, you won't forget to find out what's become of the actor Suzdaltsev these days? Is he alive? Is he well? Many's the drink we downed together once upon a time...In ""The Great Mail Robbery"" his acting was inimitable...I recall he was acting at the time in Elizabetgrad...","Шамраев. ...Так вы же, Ирина Николаевна, сделайте милость, не забудьте навести справочку: где теперь актер Суздальцев? Жив ли? Здоров ли? Вместе пивали когда-то... В «Ограбленной почте» играл неподражаемо... С ним тогда, помню, в Елисаветграде служил трагик Измайлов, тоже личность замечательная...",Shamraev enters to announce that the horses have arrived and it is time for Arkadina to depart. He asks Arkadina to find out what has become of a favorite actor.,,"Today within Ukraine's Kirovohrad Oblast. From 1865 onward, it was the уездный центр Херсонской губернии",48.3036,32.16,"Shamraev, Arkadina, Trigorin",,,,,,,,,,,,Moscow,city,real,mentioned,Moscow,Москва,Moscow,Москва,many day's journey from story setting,yes,The Seagull,Act III,169,"Nina: I felt we would meet again. Boris Alekseevich, I've made up my mind once and for all, the die is cast, I'm going on the stage. Tomorrow I'll be gone, I'm leaving my father, abandoning everything, starting a new life... I'm travelling, like you to Moscow, We shall meet there.

Trigorin: Stay at the ""Slav Bazaar"" Hotel... Let me know the minute you're there...Molchanovka Street, the Grokholsky Apartments...I'm in a hurry...","Нина. Я чувствовала, что мы еще увидимся. (Возбужденно.) Борис Алексеевич, я решила бесповоротно, жребий брошен, я поступаю на сцену. Завтра меня уже не будет здесь, я ухожу от отца, покидаю все, начинаю новую жизнь... Я уезжаю, как и вы... в Москву. Мы увидимся там.

Тригорин (оглянувшись). Остановитесь в «Славянском Базаре»... Дайте мне тотчас же знать... Молчановка, дом Грохольского... Я тороплюсь...
",Nina and Trigorin meet for the last time before both of their departures. They plan a subsequent rendezvous in Moscow.,,,55.756008,37.616409,"Trigorin, Nina",,,,,,,,,,,,The Slav Bazaar Hotel,hotel,real,mentioned,"Moscow, 17 Nicholskaya Street",Москва,Moscow,Москва,many day's journey from story setting,yes,The Seagull,Act III,169,"Nina: I felt we would meet again. Boris Alekseevich, I've made up my mind once and for all, the die is cast, I'm going on the stage. Tomorrow I'll be gone, I'm leaving my father, abandoning everything, starting a new life... I'm traveling, like you to Moscow, We shall meet there.

Trigorin: Stay at the ""Slav Bazaar"" Hotel... Let me know the minute you're there...Molchanovka Street, the Grokholsky Apartments...I'm in a hurry...","Нина. Я чувствовала, что мы еще увидимся. (Возбужденно.) Борис Алексеевич, я решила бесповоротно, жребий брошен, я поступаю на сцену. Завтра меня уже не будет здесь, я ухожу от отца, покидаю все, начинаю новую жизнь... Я уезжаю, как и вы... в Москву. Мы увидимся там.

Тригорин (оглянувшись). Остановитесь в «Славянском Базаре»... Дайте мне тотчас же знать... Молчановка, дом Грохольского... Я тороплюсь...
",Nina and Trigorin meet for the last time before both of their departures. They plan a subsequent rendezvous in Moscow.,"Once a restaurant and bar (also mentioned in Chekhov's ""Lady with a Lapdog""), the building currently serves as the Moscow Conservatory. The Moscow Art Theater itself came out of a discussion that Stanislavsky and Nemirovich had at this restaurant. ",From the Norton: Molchanovka is a street near Arvat Square within easy walking distance from the Slav Bazaar (169).,55.757885,37.623058,"Trigorin, Nina",,5,,,,,,,,,,Sorin's Estate: The Drawing Room/ Kostya's Room,estate,fictional,setting,N/A,N/A,N/A,N/A,center of story,N/A,The Seagull,Act IV ,"170, 171, 172","""One of the drawing rooms in Sorin's house, turned by Konstantin Trplyov into a workroom. Left and right doors, leading to inner rooms. Directly facing us, a glass door to the veranda. Brsides the usual drawing-room furniture, in the right corner is a writing desk, neae the left door a Turkish divan, a bookcase full of books, books on the windowsills, on chairs. - Evening. A single lamp with a shade is lit. Semi-darkness. We can hear the trees rustling and the wind wailing in the chimney. A watchman raps on a board.""

[later]

Masha: What's this for, Mama?

Polina Andreevna: Pytor Nikolaevich asked for his bed to be made up in Kostya's room...

[later]

Dorn: So many changes around here, I must say! They've turned the drawing into a study.

Masha: It's more comfortable for Konstantin Gavrilych to work here. Whenever he likes, he can go out in the garden and think.","""Одна из гостиных в доме Сорина, обращенная Константином Треплевым в рабочий кабинет. Направо и налево двери, ведущие во внутренние покои. Прямо стеклянная дверь на террасу. Кроме обычной гостиной мебели, в правом углу письменный стол, возле левой двери турецкий диван, шкап с книгами, книги на окнах, на стульях. — Вечер. Горит одна лампа под колпаком. Полумрак. Слышно, как шумят деревья и воет ветер в трубах. Стучит сторож.""

[later]

Маша. Зачем это, мама?

Полина Андреевна. Петр Николаевич просил постлать ему у Кости.

[later]

Дорн. Сколько у вас перемен, однако! Из гостиной сделали кабинет.

Маша. Здесь Константину Гаврилычу удобнее работать. Он может когда угодно выходить в сад и там думать.","The stage is set for Act IV; later the group chats in Kostya's work room, although Kostya has left.",,,,,"Mevedenko, Masha; later Treplyov and Polina Andreevna enter; Treplyov leaves and Sorin and Dorn enter.",two years after Act III,,,,,,,,,,,Sorin's Estate: The Lake,body of water,fictional,mentioned,N/A,N/A,N/A,N/A,on the estate,N/A,The Seagull,Act IV ,"170, 176, 178, 180","Masha: There are waves on the lake. Enormous ones.

[later]

Trigorin: ...Tomorrow morning, if it's calmed down, I'll head out to the lake and do some fishing....

[later]

Trigorin: If I lived on an estate like this, by a lake, you think I'd write? I'd kick this addiction and do nothing but fish.

[later]

Nina. ...Ever since my arrival I keep coming here to the latke...","Маша (припускает огня в лампе). На озере волны. Громадные.

[later]

Тригорин. Завтра утром, если утихнет, отправлюсь на озеро удить рыбу. 

[later]

Тригорин. Если бы я жил в такой усадьбе, у озера, то разве я стал бы писать? Я поборол бы в себе эту страсть и только и делал бы, что удил рыбу.

[later]

Нина. ...С самого приезда я все ходила тут... около озера.","The stage is set for Act IV. Masha is chatting with her now husband, Medvedenko; later Trigorin discusses potential plans to head to the lake before his return to Moscow; he raises the lake again during lotto; during Nina and Treplyov's reunion, she admits that she has visited the lake since she arrived.",,,,,"Mevedenko, Masha; Medvedenko, Dorn, Masha, Sorin, Polina Andreevna, Treplyov, Trigorin; Treplyov, Nina",two years after Act III,,,,,,,,,,,Sorin's Estate: The Garden,estate,fictional,mentioned,N/A,N/A,N/A,N/A,on the estate,N/A,The Seagull,Act IV ,170,"Medvedenko: It's dark outside. Somebody should tell them to pull down that stage in the garden. If stands there bare, unsightly, like a sekelton, and the scene curtain flaps in the wind. When I was going by last night, I thought somebody was on it, crying...","Медведенко. В саду темно. Надо бы сказать, чтобы сломали в саду тот театр. Стоит голый, безобразный, как скелет, и занавеска от ветра хлопает. Когда я вчера вечером проходил мимо, то мне показалось, будто кто в нем плакал.","The stage is set for Act IV. Masha is chatting with her now husband, Medvedenko.",,,,,"Mevedenko, Masha",two years after Act III,,,,,,,,,,,